{
  "id": "test_theme",
  "name": "Test Theme",
  "version": "1.0.0",
  "theme_api_version": 1,
  "tokens": {
    "color.background": "#112233",
    "asset.test": "./assets/test.svg"
  },
  "aliases": {
    "alias.asset.test": "asset.test"
  },
  "surfaces": {
    "surface.card": {
      "gradient": {
        "start": "#112233"
      },
      "texture": "alias.asset.test"
    }
  }
}
